{
 "activationMask": 0,
 "formatVersion": "1.1.0",
 "ges": [
  {
   "activeAtStart": true,
   "id": "FountainLGS",
   "kind": "LG",
   "mask": 0,
   "platform": 0,
   "points": [
    [5888.0, 5888.0, 96.0],
    [6400.0, 5888.0, 96.0]
   ],
   "src": {"kind": "synthetic", "note": "basin lip: vault or climb"}
  },
  {
   "activeAtStart": true,
   "id": "FountainLGN",
   "kind": "LG",
   "mask": 0,
   "platform": 0,
   "points": [
    [6400.0, 6400.0, 96.0],
    [5888.0, 6400.0, 96.0]
   ],
   "src": {"kind": "synthetic", "note": "basin lip: vault or climb"}
  },
  {
   "activeAtStart": true,
   "id": "FountainLGW",
   "kind": "LG",
   "mask": 0,
   "platform": 0,
   "points": [
    [5888.0, 6400.0, 96.0],
    [5888.0, 5888.0, 96.0]
   ],
   "src": {"kind": "synthetic", "note": "basin lip: vault or climb"}
  },
  {
   "activeAtStart": true,
   "id": "FountainLGE",
   "kind": "LG",
   "mask": 0,
   "platform": 0,
   "points": [
    [6400.0, 5888.0, 96.0],
    [6400.0, 6400.0, 96.0]
   ],
   "src": {"kind": "synthetic", "note": "basin lip: vault or climb"}
  },
  {
   "activeAtStart": true,
   "id": "FountainLADDER",
   "kind": "LADDER",
   "mask": 0,
   "platform": 0,
   "points": [
    [6144.0, 6076.0, 96.0],
    [6144.0, 6076.0, 416.0],
    [6144.0, 6066.0, 96.0]
   ],
   "src": {"kind": "synthetic", "note": "from the basin up the column, top flush"}
  },
  {
   "activeAtStart": true,
   "id": "FountainTopLG",
   "kind": "LG",
   "mask": 0,
   "platform": 0,
   "points": [
    [6080.0, 6080.0, 416.0],
    [6208.0, 6080.0, 416.0]
   ],
   "src": {"kind": "synthetic", "note": "column top, south lip"}
  },
  {
   "activeAtStart": true,
   "id": "FountainTopLGN",
   "kind": "LG",
   "mask": 0,
   "platform": 0,
   "points": [
    [6208.0, 6208.0, 416.0],
    [6080.0, 6208.0, 416.0]
   ],
   "src": {"kind": "synthetic", "note": "column top: hang over the basin"}
  },
  {
   "activeAtStart": true,
   "id": "FountainTopLGE",
   "kind": "LG",
   "mask": 0,
   "platform": 0,
   "points": [
    [6208.0, 6080.0, 416.0],
    [6208.0, 6208.0, 416.0]
   ],
   "src": {"kind": "synthetic", "note": "column top: hang over the basin"}
  },
  {
   "activeAtStart": true,
   "id": "FountainTopLGW",
   "kind": "LG",
   "mask": 0,
   "platform": 0,
   "points": [
    [6080.0, 6208.0, 416.0],
    [6080.0, 6080.0, 416.0]
   ],
   "src": {"kind": "synthetic", "note": "column top: hang over the basin"}
  },
  {
   "activeAtStart": true,
   "id": "PlazaBenchBack0LGS",
   "kind": "LG",
   "mask": 0,
   "platform": 0,
   "points": [
    [5184.0, 7528.0, 96.0],
    [5504.0, 7528.0, 96.0]
   ],
   "src": {"kind": "synthetic", "note": "bench back: vault over"}
  },
  {
   "activeAtStart": true,
   "id": "PlazaBenchBack0LGN",
   "kind": "LG",
   "mask": 0,
   "platform": 0,
   "points": [
    [5504.0, 7544.0, 96.0],
    [5184.0, 7544.0, 96.0]
   ],
   "src": {"kind": "synthetic", "note": "bench back: vault over"}
  },
  {
   "activeAtStart": true,
   "id": "PlazaBenchBack1LGS",
   "kind": "LG",
   "mask": 0,
   "platform": 0,
   "points": [
    [6784.0, 7528.0, 96.0],
    [7104.0, 7528.0, 96.0]
   ],
   "src": {"kind": "synthetic", "note": "bench back: vault over"}
  },
  {
   "activeAtStart": true,
   "id": "PlazaBenchBack1LGN",
   "kind": "LG",
   "mask": 0,
   "platform": 0,
   "points": [
    [7104.0, 7544.0, 96.0],
    [6784.0, 7544.0, 96.0]
   ],
   "src": {"kind": "synthetic", "note": "bench back: vault over"}
  },
  {
   "activeAtStart": true,
   "id": "PlazaBenchBack2LGS",
   "kind": "LG",
   "mask": 0,
   "platform": 0,
   "points": [
    [5184.0, 4744.0, 96.0],
    [5504.0, 4744.0, 96.0]
   ],
   "src": {"kind": "synthetic", "note": "bench back: vault over"}
  },
  {
   "activeAtStart": true,
   "id": "PlazaBenchBack2LGN",
   "kind": "LG",
   "mask": 0,
   "platform": 0,
   "points": [
    [5504.0, 4760.0, 96.0],
    [5184.0, 4760.0, 96.0]
   ],
   "src": {"kind": "synthetic", "note": "bench back: vault over"}
  },
  {
   "activeAtStart": true,
   "id": "PlazaBenchBack3LGS",
   "kind": "LG",
   "mask": 0,
   "platform": 0,
   "points": [
    [6784.0, 4744.0, 96.0],
    [7104.0, 4744.0, 96.0]
   ],
   "src": {"kind": "synthetic", "note": "bench back: vault over"}
  },
  {
   "activeAtStart": true,
   "id": "PlazaBenchBack3LGN",
   "kind": "LG",
   "mask": 0,
   "platform": 0,
   "points": [
    [7104.0, 4760.0, 96.0],
    [6784.0, 4760.0, 96.0]
   ],
   "src": {"kind": "synthetic", "note": "bench back: vault over"}
  },
  {
   "activeAtStart": true,
   "id": "PlazaBenchBack4LGW",
   "kind": "LG",
   "mask": 0,
   "platform": 0,
   "points": [
    [4744.0, 5504.0, 96.0],
    [4744.0, 5184.0, 96.0]
   ],
   "src": {"kind": "synthetic", "note": "bench back: vault over"}
  },
  {
   "activeAtStart": true,
   "id": "PlazaBenchBack4LGE",
   "kind": "LG",
   "mask": 0,
   "platform": 0,
   "points": [
    [4760.0, 5184.0, 96.0],
    [4760.0, 5504.0, 96.0]
   ],
   "src": {"kind": "synthetic", "note": "bench back: vault over"}
  },
  {
   "activeAtStart": true,
   "id": "PlazaBenchBack5LGW",
   "kind": "LG",
   "mask": 0,
   "platform": 0,
   "points": [
    [4744.0, 7104.0, 96.0],
    [4744.0, 6784.0, 96.0]
   ],
   "src": {"kind": "synthetic", "note": "bench back: vault over"}
  },
  {
   "activeAtStart": true,
   "id": "PlazaBenchBack5LGE",
   "kind": "LG",
   "mask": 0,
   "platform": 0,
   "points": [
    [4760.0, 6784.0, 96.0],
    [4760.0, 7104.0, 96.0]
   ],
   "src": {"kind": "synthetic", "note": "bench back: vault over"}
  },
  {
   "activeAtStart": true,
   "id": "PlazaBenchBack6LGW",
   "kind": "LG",
   "mask": 0,
   "platform": 0,
   "points": [
    [7528.0, 5504.0, 96.0],
    [7528.0, 5184.0, 96.0]
   ],
   "src": {"kind": "synthetic", "note": "bench back: vault over"}
  },
  {
   "activeAtStart": true,
   "id": "PlazaBenchBack6LGE",
   "kind": "LG",
   "mask": 0,
   "platform": 0,
   "points": [
    [7544.0, 5184.0, 96.0],
    [7544.0, 5504.0, 96.0]
   ],
   "src": {"kind": "synthetic", "note": "bench back: vault over"}
  },
  {
   "activeAtStart": true,
   "id": "PlazaBenchBack7LGW",
   "kind": "LG",
   "mask": 0,
   "platform": 0,
   "points": [
    [7528.0, 7104.0, 96.0],
    [7528.0, 6784.0, 96.0]
   ],
   "src": {"kind": "synthetic", "note": "bench back: vault over"}
  },
  {
   "activeAtStart": true,
   "id": "PlazaBenchBack7LGE",
   "kind": "LG",
   "mask": 0,
   "platform": 0,
   "points": [
    [7544.0, 6784.0, 96.0],
    [7544.0, 7104.0, 96.0]
   ],
   "src": {"kind": "synthetic", "note": "bench back: vault over"}
  },
  {
   "activeAtStart": true,
   "id": "Ledge128LG",
   "kind": "LG",
   "mask": 0,
   "platform": 0,
   "points": [
    [3072.0, 11776.0, 128.0],
    [3328.0, 11776.0, 128.0]
   ],
   "src": {"kind": "synthetic", "note": "under the hang height: hop-up"}
  },
  {
   "activeAtStart": true,
   "id": "Ledge128LGW",
   "kind": "LG",
   "mask": 0,
   "platform": 0,
   "points": [
    [3072.0, 12288.0, 128.0],
    [3072.0, 11776.0, 128.0]
   ],
   "src": {"kind": "synthetic", "note": "block side"}
  },
  {
   "activeAtStart": true,
   "id": "Ledge128LGE",
   "kind": "LG",
   "mask": 0,
   "platform": 0,
   "points": [
    [3328.0, 11776.0, 128.0],
    [3328.0, 12288.0, 128.0]
   ],
   "src": {"kind": "synthetic", "note": "block side"}
  },
  {
   "activeAtStart": true,
   "id": "Ledge208LG",
   "kind": "LG",
   "mask": 0,
   "platform": 0,
   "points": [
    [3584.0, 11776.0, 208.0],
    [3840.0, 11776.0, 208.0]
   ],
   "src": {"kind": "synthetic", "note": "lowest hang and climb"}
  },
  {
   "activeAtStart": true,
   "id": "Ledge208LGW",
   "kind": "LG",
   "mask": 0,
   "platform": 0,
   "points": [
    [3584.0, 12288.0, 208.0],
    [3584.0, 11776.0, 208.0]
   ],
   "src": {"kind": "synthetic", "note": "block side"}
  },
  {
   "activeAtStart": true,
   "id": "Ledge208LGE",
   "kind": "LG",
   "mask": 0,
   "platform": 0,
   "points": [
    [3840.0, 11776.0, 208.0],
    [3840.0, 12288.0, 208.0]
   ],
   "src": {"kind": "synthetic", "note": "block side"}
  },
  {
   "activeAtStart": true,
   "id": "Ledge264LG",
   "kind": "LG",
   "mask": 0,
   "platform": 0,
   "points": [
    [4096.0, 11776.0, 264.0],
    [4352.0, 11776.0, 264.0]
   ],
   "src": {"kind": "synthetic", "note": "container lip height"}
  },
  {
   "activeAtStart": true,
   "id": "Ledge264LGW",
   "kind": "LG",
   "mask": 0,
   "platform": 0,
   "points": [
    [4096.0, 12288.0, 264.0],
    [4096.0, 11776.0, 264.0]
   ],
   "src": {"kind": "synthetic", "note": "block side"}
  },
  {
   "activeAtStart": true,
   "id": "Ledge264LGE",
   "kind": "LG",
   "mask": 0,
   "platform": 0,
   "points": [
    [4352.0, 11776.0, 264.0],
    [4352.0, 12288.0, 264.0]
   ],
   "src": {"kind": "synthetic", "note": "block side"}
  },
  {
   "activeAtStart": true,
   "id": "Ledge320LG",
   "kind": "LG",
   "mask": 0,
   "platform": 0,
   "points": [
    [4608.0, 11776.0, 320.0],
    [4864.0, 11776.0, 320.0]
   ],
   "src": {"kind": "synthetic", "note": "highest standing-jump grab"}
  },
  {
   "activeAtStart": true,
   "id": "Ledge320LGW",
   "kind": "LG",
   "mask": 0,
   "platform": 0,
   "points": [
    [4608.0, 12288.0, 320.0],
    [4608.0, 11776.0, 320.0]
   ],
   "src": {"kind": "synthetic", "note": "block side"}
  },
  {
   "activeAtStart": true,
   "id": "Ledge320LGE",
   "kind": "LG",
   "mask": 0,
   "platform": 0,
   "points": [
    [4864.0, 11776.0, 320.0],
    [4864.0, 12288.0, 320.0]
   ],
   "src": {"kind": "synthetic", "note": "block side"}
  },
  {
   "activeAtStart": true,
   "id": "WallJump408LG",
   "kind": "LG",
   "mask": 0,
   "platform": 0,
   "points": [
    [5120.0, 11776.0, 408.0],
    [5504.0, 11776.0, 408.0]
   ],
   "src": {"kind": "synthetic", "note": "wall jump: kick up to this lip"}
  },
  {
   "activeAtStart": true,
   "id": "WallJump408LGW",
   "kind": "LG",
   "mask": 0,
   "platform": 0,
   "points": [
    [5120.0, 12288.0, 408.0],
    [5120.0, 11776.0, 408.0]
   ],
   "src": {"kind": "synthetic", "note": "block side"}
  },